{
  "forensic_event_id": "e1e1e1e1-e1e1-4ee1-8ee1-e1e1e1e1e1e1",
  "correlation_id": "aaaaaaaa-aaaa-4aaa-8aaa-aaaaaaaaaaaa",
  "run_id": "gnat-run-fixture-001",
  "event_type": "gnat_dispatch_negotiated",
  "negotiation_outcome": "ready_for_fa_local_dispatch",
  "shard_id": null,
  "worker_type": null,
  "shard_outcome": null,
  "receipt_state": null,
  "timestamp_utc": "2030-01-01T00:10:00Z",
  "summary": "FA Local admitted Cortex Gnat run gnat-run-fixture-001 for bounded dispatch.",
  "redaction_level": "linkage_only",
  "payload_minimized": true
}
