{
  "forensic_event_id": "e2e2e2e2-e2e2-4ee2-8ee2-e2e2e2e2e2e2",
  "correlation_id": "aaaaaaaa-aaaa-4aaa-8aaa-aaaaaaaaaaaa",
  "run_id": "gnat-run-fixture-001",
  "event_type": "gnat_shard_dispatched",
  "negotiation_outcome": "ready_for_fa_local_dispatch",
  "shard_id": "gnat-run-fixture-001-shard-0000",
  "worker_type": "markdown_syntax",
  "shard_outcome": "completed",
  "receipt_state": "complete",
  "timestamp_utc": "2030-01-01T00:10:01Z",
  "summary": "Cortex Gnat shard gnat-run-fixture-001-shard-0000 completed.",
  "redaction_level": "linkage_only",
  "payload_minimized": true
}
